{
  "$schema": "https://json-schema.org/draft/2020-12/schema",
  "$id": "https://frankenalignment.invalid/schemas/action_proposal",
  "title": "Draft ActionProposal",
  "description": "Draft shape only; does not establish runtime authority, authenticity or semantic conformance.",
  "type": "object",
  "additionalProperties": false,
  "properties": {
    "schema_version": {
      "const": "fa.action/0.1"
    },
    "action_id": {
      "type": "string",
      "minLength": 1,
      "maxLength": 128,
      "pattern": "^[A-Za-z0-9][A-Za-z0-9_.:/-]{0,127}$"
    },
    "tenant_id": {
      "type": "string",
      "minLength": 1,
      "maxLength": 128,
      "pattern": "^[A-Za-z0-9][A-Za-z0-9_.:/-]{0,127}$"
    },
    "run_id": {
      "type": "string",
      "minLength": 1,
      "maxLength": 128,
      "pattern": "^[A-Za-z0-9][A-Za-z0-9_.:/-]{0,127}$"
    },
    "branch": {
      "enum": [
        "production",
        "sandbox"
      ]
    },
    "effect_kind": {
      "type": "string",
      "minLength": 1,
      "maxLength": 128,
      "pattern": "^[A-Za-z0-9][A-Za-z0-9_.:/-]{0,127}$"
    },
    "adapter_id": {
      "type": "string",
      "minLength": 1,
      "maxLength": 128,
      "pattern": "^[A-Za-z0-9][A-Za-z0-9_.:/-]{0,127}$"
    },
    "target_binding": {
      "type": "string",
      "minLength": 1,
      "maxLength": 128,
      "pattern": "^[A-Za-z0-9][A-Za-z0-9_.:/-]{0,127}$"
    },
    "payload_sha256": {
      "type": "string",
      "minLength": 64,
      "maxLength": 64,
      "pattern": "^[0-9a-f]{64}$"
    },
    "payload_bytes": {
      "type": "integer",
      "minimum": 0,
      "maximum": 65536
    },
    "units": {
      "type": "integer",
      "minimum": 1,
      "maximum": 9007199254740991
    },
    "policy_epoch": {
      "type": "integer",
      "minimum": 1,
      "maximum": 9007199254740991
    },
    "required_observations": {
      "type": "array",
      "items": {
        "type": "string",
        "minLength": 1,
        "maxLength": 128,
        "pattern": "^[A-Za-z0-9][A-Za-z0-9_.:/-]{0,127}$"
      },
      "uniqueItems": true,
      "maxItems": 16
    }
  },
  "required": [
    "schema_version",
    "action_id",
    "tenant_id",
    "run_id",
    "branch",
    "effect_kind",
    "adapter_id",
    "target_binding",
    "payload_sha256",
    "payload_bytes",
    "units",
    "policy_epoch",
    "required_observations"
  ]
}
